{
  "task_id": "TASK-002",
  "status": "completed",
  "summary": "Replaced the empty-state copy in the projects list with an actionable message and a link to the create-project flow. One string constant and its test.",
  "steps_completed": [],
  "files_changed": [
    "src/projects/ProjectListEmpty.tsx",
    "src/projects/ProjectListEmpty.test.tsx"
  ],
  "files_created": [],
  "files_deleted": [],
  "tests_added": [
    {
      "file": "src/projects/ProjectListEmpty.test.tsx",
      "covers": "the empty state renders the actionable copy and a working create-project link"
    }
  ],
  "tests_run": [
    {
      "command": "npm test -- src/projects/ProjectListEmpty.test.tsx",
      "result": "pass",
      "output_summary": "3 passed, 0 failed"
    },
    {
      "command": "npm run lint",
      "result": "pass",
      "output_summary": "0 errors"
    },
    {
      "command": "npm run typecheck",
      "result": "pass",
      "output_summary": "no type errors"
    }
  ],
  "acceptance_addressed": [
    {
      "criterion_id": "AC-1",
      "how": "the empty state now reads 'No projects yet. Create your first project to get started.'"
    },
    {
      "criterion_id": "AC-2",
      "how": "the message includes a link to the create-project flow, asserted in the test"
    }
  ],
  "deviations": [],
  "unresolved_concerns": [],
  "architecture_problems_found": [],
  "new_work_discovered": [],
  "blockers": [],
  "scope_assessment": {
    "files_in_scope": true,
    "explanation": "Two files, both in scope for a copy change plus its test."
  },
  "self_assessment": {
    "confidence": "high",
    "uncertainty_areas": [],
    "recommendation": "Copy is a product-facing choice the requester should confirm reads well."
  },
  "completed_at": "2026-02-20",
  "environment": {
    "confirmed_by_user": true,
    "confirmed_at": "2026-02-20",
    "runtime": "Node 20.11",
    "environment_manager": "nvm",
    "package_manager": "npm (package-lock.json)",
    "services_running": [],
    "config_present": [],
    "commands_confirmed": [
      "npm test",
      "npm run lint",
      "npm run typecheck"
    ],
    "baseline_state": "The suite passed on the revision before the change: 412 passed, 0 failed, 3 skipped. The 3 skips pre-date this change and were confirmed as pre-existing.",
    "environment_findings": [
      {
        "finding": "The default shell had no Node manager active, so `npm test` initially reported 'command not found'. This is an environment finding, not a defect in the changed component.",
        "resolved": true,
        "effect_on_verification": "Resolved by selecting Node 20.11 before running verification; no verification was performed in the unconfigured shell."
      }
    ]
  }
}
